{
  "schema_version": "1.0.0",
  "closure_manifest_id": "CM-001",
  "issue_id": "ISSUE-001",
  "closure_input_manifest_anchors": [
    {
      "manifest_anchor_id": "ANCHOR-001",
      "manifest_id": "AM-001",
      "manifest_revision": "rev-0001",
      "immutable_path": "manifests/AM-001-rev-0001.json",
      "manifest_sha256": "aaaaaaaaaaaaaaaaaaaaaaaaaaaaaaaaaaaaaaaaaaaaaaaaaaaaaaaaaaaaaaaa",
      "storage_scope": "repository-redacted"
    }
  ],
  "r4_phase_plan_artifact_ref": {
    "artifact_id": "ART-001",
    "artifact_revision": "rev-0001",
    "storage_class": "repository-redacted",
    "immutable_locator": "samples/valid/artifact-manifest.min.json"
  },
  "plan_revision": 1,
  "pre_final_ledger_artifact_ref": {
    "artifact_id": "ART-001",
    "artifact_revision": "rev-0001",
    "storage_class": "repository-redacted",
    "immutable_locator": "samples/valid/artifact-manifest.min.json"
  },
  "final_verification_artifact_ref": {
    "artifact_id": "ART-001",
    "artifact_revision": "rev-0001",
    "storage_class": "repository-redacted",
    "immutable_locator": "samples/valid/artifact-manifest.min.json"
  },
  "proposed_closure_disposition": "proposed-closed",
  "proposed_closure_timestamp": "2026-06-16T00:00:00Z",
  "actor": "human",
  "notes": "minimal sample"
}
